{
  "format": 1,
  "kind": "app",
  "id": "org.shellcanvas.dialog-example",
  "version": "0.1.0",
  "title": "Field Notes",
  "permissions": [
    "system.dialogs",
    "files.read",
    "files.edit",
    "files.create",
    "system.storage",
    "system.clipboard.read",
    "system.clipboard.write"
  ]
}
